{
    "width":990,
    "height":580,
    "concepts":[
        {
            "name":"Employee",
            "entry":true,
            "x":474,
            "y":43,
            "width":80,
            "height":80,
            "attributes":[
                {
                    "sequence":10,
                    "name":"email",
                    "category":"identifier",
                    "type":"String",
                    "init":"",
                    "essential":true,
                    "sensitive":false
                },
                {
                    "sequence":20,
                    "name":"lastName",
                    "category":"required",
                    "type":"String",
                    "init":"",
                    "essential":true,
                    "sensitive":false
                },
                {
                    "sequence":30,
                    "name":"firstName",
                    "category":"required",
                    "type":"String",
                    "init":"",
                    "essential":true,
                    "sensitive":false
                }
            ]
        },
        {
            "name":"Project",
            "entry":true,
            "x":63,
            "y":43,
            "width":80,
            "height":80,
            "attributes":[
                {
                    "sequence":10,
                    "name":"name",
                    "category":"identifier",
                    "type":"String",
                    "init":"",
                    "essential":true,
                    "sensitive":false
                },
                {
                    "sequence":20,
                    "name":"description",
                    "category":"attribute",
                    "type":"String",
                    "init":"",
                    "essential":false,
                    "sensitive":false
                }
            ]
        },
        {
            "name":"Task",
            "entry":false,
            "x":270,
            "y":223,
            "width":80,
            "height":60,
            "attributes":[
                {
                    "sequence":10,
                    "name":"description",
                    "category":"attribute",
                    "type":"String",
                    "init":"",
                    "essential":false,
                    "sensitive":false
                }
            ]
        }
    ],
    "relations":[
        {
            "from":"Project",
            "to":"Task",
            "category":"relationship",
            "internal":true,
            "fromToName":"tasks",
            "fromToMin":"0",
            "fromToMax":"N",
            "fromToId":false,
            "toFromName":"project",
            "toFromMin":"1",
            "toFromMax":"1",
            "toFromId":true
        },
        {
            "from":"Employee",
            "to":"Task",
            "category":"relationship",
            "internal":true,
            "fromToName":"tasks",
            "fromToMin":"0",
            "fromToMax":"N",
            "fromToId":false,
            "toFromName":"employee",
            "toFromMin":"1",
            "toFromMax":"1",
            "toFromId":true
        }
    ]
}