{
    "width": 3000,
    "height": 3000,
    "concepts": [
        {
            "name": "Focus",
            "entry": true,
            "x": 1255,
            "y": 1143,
            "width": 120,
            "height": 120,
            "attributes": []
        },
        {
            "name": "Task",
            "entry": true,
            "x": 1682,
            "y": 1141,
            "width": 120,
            "height": 120,
            "attributes": []
        },
        {
            "name": "Project",
            "entry": true,
            "x": 1936,
            "y": 1140,
            "width": 120,
            "height": 120,
            "attributes": []
        },
        {
            "name": "User",
            "entry": true,
            "x": 1441,
            "y": 982,
            "width": 120,
            "height": 120,
            "attributes": []
        },
        {
            "name": "DueDate",
            "entry": true,
            "x": 1857,
            "y": 1427,
            "width": 120,
            "height": 120,
            "attributes": []
        },
        {
            "name": "Priority",
            "entry": true,
            "x": 2025,
            "y": 1424,
            "width": 120,
            "height": 120,
            "attributes": []
        },
        {
            "name": "DueDateChangeComment",
            "entry": true,
            "x": 1924,
            "y": 1701,
            "width": 120,
            "height": 120,
            "attributes": []
        },
        {
            "name": "Urgency",
            "entry": true,
            "x": 1938,
            "y": 1280,
            "width": 120,
            "height": 120,
            "attributes": []
        },
        {
            "name": "PriorityChangeComment",
            "entry": true,
            "x": 1741,
            "y": 1703,
            "width": 120,
            "height": 120,
            "attributes": []
        },
        {
            "name": "DescisionEngine",
            "entry": true,
            "x": 1439,
            "y": 1140,
            "width": 120,
            "height": 120,
            "attributes": []
        },
        {
            "name": "UrgencyEstimation",
            "entry": true,
            "x": 1437,
            "y": 1304,
            "width": 120,
            "height": 120,
            "attributes": []
        },
        {
            "name": "CommitmentType",
            "entry": true,
            "x": 2203,
            "y": 1135,
            "width": 120,
            "height": 120,
            "attributes": []
        },
        {
            "name": "GovernmentCommitment",
            "entry": true,
            "x": 2382,
            "y": 979,
            "width": 120,
            "height": 120,
            "attributes": []
        },
        {
            "name": "ProffesionalCommitment",
            "entry": true,
            "x": 2382,
            "y": 1130,
            "width": 120,
            "height": 120,
            "attributes": []
        },
        {
            "name": "PrivateCommitment",
            "entry": true,
            "x": 2381,
            "y": 1296,
            "width": 120,
            "height": 120,
            "attributes": []
        },
        {
            "name": "SelfCommitment",
            "entry": true,
            "x": 2381,
            "y": 1440,
            "width": 120,
            "height": 120,
            "attributes": []
        }
    ],
    "relations": []
}